name,description,type
137 Murray Street Guesthouse,The distinguished guesthouse portrays an aura of old-world charm with its warm wooden floors cozy fireplaces high pressed ceilings and antique fittings,accommodation
23 on Hazelwood,23 on Hazelwood and 23 on Rubenstein trendy street cafés in Pretoria welcome the hustlers the creative entrepreneurs the misfits and the rebels in the hope that you may find creative inspiration in what we do and how we do it,accommodation
23 on Rubenstein,23 on Hazelwood and 23 on Rubenstein trendy street cafés in Pretoria welcome the hustlers the creative entrepreneurs the misfits and the rebels in the hope that you may find creative inspiration in what we do and how we do it,accommodation
3 at Marion Guesthouse,Our location makes us the ideal destination for business or leisure with quick and easy access to the N1 and the N4 highways Let us be your home away from home for meetings sight-seeing and everything in-between,accommodation
37 on Charles,Welcome to 37 on Charles  Ideally located for guests visiting the greater Pretoria area we are situated halfway between Pretoria CBD and Menlyn in Justice Mahomed Street formerly known as Charles Street in the beautiful and tranquil Baileys Muckleneuk,accommodation
Centurion,Tourist attraction in Tshwane - Centurion,area
Garsfontein,Tourist attraction in Tshwane - Garsfontein,area
Pretoria North,Tourist attraction in Tshwane - Pretoria North,area
Adventure Zone Cullinan,Nestled in the quaint miners village of Cullinan just 30 minutes from Pretoria Cullinan Adventure Zone is home to some of the best adrenaline pumping activities in Gauteng We offer Individuals & Companies a wide range of activities to be enjoyed as a fun adventure or as a part of a comprehensive team build,attraction
African Nights Guest House,Consist of two houses - African Nights Guesthouses mainhouse and Protea House - situated in a quiet and established neighborhoods of Theresapark in the north of Pretoria,accommodation
Afro Boer,Afro-Boer bakers cafe has been open since August 2013 ​It has won multiple prestigious awards with-Eat-Out Magazine-Best of Pretoria-Diners Club Wine Awards-TripAdvisor Service Excellence Awards- been nominated for a RASA Rosette Award-HOSCO Restaurant Awards-Cafe of the Year Award,restaurant
AIDC Automotive Industry Development Supplier Park Conference Centre,The 4- star graded Conference Centre at the Automotive Supplier Park is a world class facility which caters for all conferencing needs   The seven fully equipped rooms accommodate 10 to 230 delegates,venue
Anew Hotel Hatfield,Situated in the bustling suburb of Hatfield Pretoria ANEW Hotel Hatfield offers guests 3-star accommodation as base to explore one of our nations capital cities Perfect for the travelling executive our hotel is conveniently located near major highways as well as the Hatfield Gautrain Station,accommodation
Fortis Hotel Capital,Nestled at the top of the Times Square Casino in Menlyn Pretoria Forti Grill and Bar is perfectly situated to give you a view of Eastern Pretoria like no other  Forti s menu has been painstakingly crafted with his years of experience and his insatiable love of food ,accommodation
Anew Hotel Centurion,Set in the business hub of Centurion Pretoria near major sports stadiums multiple businesses and the Gautrain station ANEW Hotel Centurion offers you the perfect base to discover the gateway to Gauteng,accommodation
Aroma Gelato and Waffle Lounge,Welcome to Aroma Gelato and Waffle lounge  a bite away from heaven!We offer fresh natural mouth-watering Italian gelato which will awaken your senses and change your taste buds to a new way of life,restaurant
at the Rocks Country Estate,At The Rocks Country Estate is a place to relax and connect and aims to provide exclusive friendly and affordable accommodation to visitors attending weddings in the area or visiting the historical and picturesque areas around Cullinan,accommodation
B Guest House,Come and feel right at home in the rich ambiance of this charming Guesthouse in Arcadia Pretoria/Tshwane The main residence was built in Dutch style in 1929 by architect builder and painter Henk Horstmanshof and declared a Provincial Heritage site,accommodation
Baobab Cafe Grill,Enjoy the sumptuous and varying tastes of the African continent in the tranquil environment of a truly Pan-African restaurant Come dine at the Baobab Cafe and Grill sit on the terrace enjoy the uniquely African setting and feel the tension melt away,restaurant
Batter Boys Boutique Hotel,With over 23 years of experience in the business Batter Boys have literally seen it all They  successfully catered for 4500 guests at the Presidential Inauguration in 2009 Let us take the worry out of your function and event planning,accommodation
Bill Harrops Balloon Safaris,Bill Harrops Balloon Safaris Is ultimate high in elegance style – hot air ballooning in ancient Magaliesberg Mountain Valley A unique sightseeing tour while you serenely drift with the wind Enjoy a glass a bubbly on landing followed by a full English breakfast,attraction
Brosad Travel Services,Brosad Travel Services has many years of experience in offering travellers to Southern Africa good value for money unique holidays and travel solutions Our market is mainly situated in Europe but we offer our services worldwide,service
Capital Craft Beer Academy,Craft beers are much more than just a refreshing beverage each beer has a story to tell Our tasty dishes will elaborate on these tales and are designed to complement the spicy taste of barley/wheat and hops It is also part of our mission to educate our clientèle about the brewing process the different types of beer and also to help you discover the rich fragrances aromas and tastes locked away in each beer you order,attraction
Capito,A fresh new Italian restaurant in the heart of Hazelwood in Pretoria. Hearty quality food from a cozy spot in the food hub of Pretoria,restaurant
Caraffa,Since opening in 1990 Caraffa has become a very well established Italian restaurant due to its accurate unique and true embodiment of the family restaurant,restaurant
Carbon Bistro,Carbon Bistro is focused on offering the core values of good affordable gourmet cuisine delivered straight to you,restaurant
Casa Toscana Lodge,Casa Toscana is ideally located within close proximity to the CSIR Menlyn shopping Centre and Hatfield and offers easy access to these rapidly developing commercial hubs While the lodge has a private and exclusive atmosphere it is open to anyone and our staff aim to provide first-class hospitality that you would expect from a 4-star accommodation,accommodation
Castello di Monte,The Tuscan style estate portrays pure luxury and elegance and offers spectacular views of the hills in and around the capital city The landscaped gardens with mature olive trees and lavender bushes give an Italian flavour to the African landscapeYou will hardly notice that you are in the middle of a bustling city,restaurant
Castle Bush Camp,Tucked away in the heart of the South African bushveld yet a convenient drive from the centre of Gauteng Castle Inn Resort offers the perfect getaway team building conferencing and camp location,accommodation
Central Restaurant,Located in the heart of the Village Hazelwood is Central The restaurant has been 25 years in the making and is a culmination of all my experiences in the industry which started when I was just 16 washing dishes and rolling cutlery in my dads restaurant,restaurant
Centurion Mall,Centurion Mall offers its community a unique space not only to shop but also to socialise and enjoy some of the finer things in life,shopping
City Lodge Hotel Hatfield,City Lodge Hotel Hatfield provides visitors to the capital city with an ideal location close to the iconic Union Buildings embassies sports grounds universities cultural landmarks shopping and entertainment destinations and the Gautrain Hatfield Station,accommodation
City Lodge Lynwood,The 205-room City Lodge Hotel Lynnwood is located within the Lynnwood Bridge Complex in Pretoria East with convenient access to a wide range of business shopping dining and entertainment destinations in this modern mixed-use precinct,accommodation
Colcacchio,where the pizza place started This is just your typical Boy meets Girl Boy falls in love with girl Boy joins forces as master entrepreneur and master restaurateur,restaurant
Conference Consultancy SA,We innovate for action Our clients are taken on a journey of discovery inside the box by identifying opportunities that already exist in your immediate environment and applying it differently in the new digital meeting environment,service
Constantia Guest Lodge,Whether visiting Pretoria for business tourism or visiting friends and family we are delighted to be of your service and to make you feel right at home Relax on the veranda with a drink or enjoy our free wi-fi internet to catch up with business and loved-ones,accommodation
Cornerstone Guest Lodge,Cornerstone Lodge is situated in a very central area in the east of Pretoria and although we are close to all the main attractions in and around Pretoria you can often hear the quiet of the night The original house was built in the early 1970s and then purchased by us in 1997 At first it was just a dream to convert our home into a guesthouse but it soon became a reality,accommodation
Court Classique Suite Hotel,Court Classique Suite Hotel Pretoria has been serving the Diplomatic Government Business and International Leisure Travel Market since 1997 Nestling in upmarket diplomatic suburb of Arcadia Pretoria the Court Classique Suite hotel offers easy access to the major Gauteng business centres as well as a host of superb restaurants cinemas shops and cultural attractions,accommodation
Crawdaddys Good Food Menlyn,Crawdaddy s established 1995 has become a landmark in Pretoria for its Seafood and Meat Dishes and has created a huge loyal family of patrons that keep the restaurant buzzing the year in and out We believe word of mouth and value for money to be our strongest advertisements and customer service satisfaction the key element in our establishment,restaurant
Cussonia Country Home,Cussonia Country Home offers intimate accommodation consisting of three rooms in the main house 2 rooms above our health centre and one self-catering cottage consisting of two rooms,accommodation
De Kloof Restaurant,De Kloof is uncompromisingly and unapologetically committed to quality food and innovative dishes Dishes and prepared according to classic European techniques with local influences,restaurant
Pepper Chair,Located in Centurion Pepper Chair is a unique restaurant venue that features an extensive food and beverage menu for lunch and dinner in a comfortable and lively environment,restaurant
Dewetswild,Let DeWetsWild Assist You with Reservations At 277 Destinations Right Across South Africa Ideal Bases For Exploring Our National Parks Game And Nature Reserves,attraction
Ditsong Kruger Museum,The Museum consists of the original house in which S J P Kruger President of the old Zuid-Afrikaansche Republiek ZAR and his family lived during the last years of the 19th century as well as two display halls and President Krugers State Railway Coach The Kruger house built in 1884 was the original home of Paul Kruger President of the former Transvaal Boer Republic The house has been refurbished to reflect the time when the President and his wife Gezina Kruger lived there,museum
E Biking Africa Pty Ltd, Exhilarating effortless wild game experience An exhilarating half-day experience in nature for first time e-bikers,service
Cullinan Tours,Tourist attraction in Tshwane - Cullinan Tours,service
Ebuhleni Tours Pty Ltd,Ebuhleni Tours is a fully registered entity under -Pty Ltd It was founded on the 17 October 2005 as a cc and converted to a Pty- Ltd on the 05 October 2013 Its principal operation is the conveyance of tourists airport transfer travel and trips,service
El Mikho Travel Tours,El Mikho Travel and Tours is a South African Tour Operator which was established in 2012 as a people company in South Africa Since then we have successfully acted as a world-class tour and safari operator in South Africa and other countries in Southern Africa,service
Eternal Partners Business Solution Pty Ltd,Change your routine during the day eat lunch somewhere new take new ways to work hangout or lunch with different people go for a run in the middle of the night,service
Famba Famba Tour Design Specialists,Famba Famba is your tour design specialist partner when it comes to creating unforgettable lifetime moments,service
Fishmonger Centurion,Welcome to Fishmonger where we serve you the best quality freshest most delicious fish dishes in South Africa Choose any one of our 31 dishes including prawns mussels oyster,restaurant
Fleisherei Bistro,With the delicious Fleisherei Bistro menu you can start your day with a refreshing breakfast or maybe indulge in our lunch or dinner specialities focused on exciting modern cuisine,restaurant
Taris Concepts,Tourist attraction in Tshwane - Taris Concepts,restaurant
Freedom Park SA,Freedom Park celebrates South Africas heritage It is a centre of knowledge aimed at deepening the understanding of the nation It strives to accommodate all of the countrys experiences and symbols to tell one coherent story Freedom Park is a cultural institution housing a museum and a memorial dedicated to chronicling and honouring the many who contributed to South Africas liberation,attraction
Fumo,Highly regarded authentic Italian cuisine in heart of the South African capital Pretoria Internationally recognised Executive Chef Claudio Uccello from Naples with experience in New York Montecarlo London Venice Singapore and his lovely home town Napoli,restaurant
Gabbata Lodge Restaurant,Youve been to the rest Now come to the best At Gabbata Lodge Restaurant we pride ourselves in our great dishes using only the finest ingredients and prepared with care and attention for guests with distinguished culinary expectations,restaurant
Garden Court Hatfield Hotel Pretoria,Accommodation at Garden Court Hatfield is comfortable and inviting with 157 bright and modern en-suite rooms on offer A choice of either a queen bed or two double beds makes our Hatfield accommodation perfect for all types of traveller Air conditioning room-service free uncapped WiFi a writing desk bathroom with bath and shower in-room tea and coffee making facilities DStv concierge service and the added convenience of room service ensures a relaxed pleasant stay,accommodation
Glen Marion Guest House,Glen Marion Guest House offers upmarket hospitality for a comfortable stay in Pretoria East South Africa The  Guest House is located within close proximity from Menlyn Centre Menlyn Retail Park Menlyn Maine and other businesses in the Menlyn region,accommodation
Graceland Conference Lifestyle Centre,Let tranquility reboot you into a new life experience Graceland Conference and Lifestyle Center is the ideal venue for private retreats indulgent relaxations at the lifestyle center as well as hosting both business and social occasions family gatherings and weddings,venue
Green Valley Lodge,Green Valley Lodge is nestled below the Wonderboom South Nature Reserve which is one of Pretorias popular Heritage sites,accommodation
Ndila Transfers,Ndila Transfers services are airport transfers- business transfers- chauffeur drive -tour drive point to point  We guarantee the best professional service and punctuality at all times  We cater for all disabilities with easy access cars  We operate to and from the OR Tambo Lanseria Airport and Wonderboom Airport,service
Next to Apartment Hotel,NEXT TO Apartment Hotel is unmatched in terms of luxury living architectural beauty with a touch of art in the heart of Hatfield near Lynnwood Menlo Park and Menlyn Tshwane Whether you are career oriented the trend setter looking for the perfect social scene or the family looking for a homely stay away from home then Next To Apartment Hotel is the place for you,accommodation
Ogalito Restaurant Centurion,O Galito inherits its cuisine from our Portuguese forefathers and is reminiscent of L M in the old days when readily available prawns - langoustines - crab - lobsters and oysters were prepared in boundless platters,restaurant
Pachas Restaurant,The Club Centre offers safe and secure parking either on the ground floor or underground  Simply come up with the escalators or hop in the lift and press level one Our menu offers Upmarket Steakhouse fare as well as a wide variety of seafood and poultry Pachas has many private venue options for that special occasion business luncheon or dinner,restaurant
Passi Deli,Situated in the heart of Centurion in the rustic suburb of Lyttelton Passi from the word passion wasstarted in May 2010 Passi with its Cape-influenced aesthetic,restaurant
Phahama Lodge,Welcome to Phahama Lodge where we witness Africa rising to her full potential within our lifetime Derived from Sesotho one of the 11 official languages of South Africa Phahama encapsulates the essence of empowerment advancement and elevation Our creative journey began in June 2010 with a vision to establish a haven where communities – comprising businesses- leadership teams- management teams- ministry groups- primary- secondary and tertiary educational institutions and families ,accommodation
Piccola Italia,Piccola Italia is a true neighbourhood restaurant It is a restaurant where everyone within the radius pops in on a regular basis Piccolas menu is an authentic Italian one ,restaurant
Plaka Menlyn,At Plaka we believe that lifes greatest pleasure is enjoying good food in good company Over the past 26 years weve built our reputation as a gathering place for all who delight in sharing dishes made with love and care whether for a quick bite or a romantic evening,restaurant
Portugalo Restaurant,From a family with a gift for cooking food came the idea to open a REAL Portuguese restaurant  Authentic real simple recipes that have been passed down for generations in our family cooked and enjoyed by us over festive memorable Sunday lunches for several years now,restaurant
Pretoria Hotel,Nestled right in the heart of Arcadia Tshwane the Pretoria Hotel offers guests inviting yet affordable hotel accommodation attentive service conference facilities and jaw-dropping rooftop views of the iconic Union Buildings and surroundings,accommodation
Pretoria National Botanical Garden,This 76 ha urban oasis is a pristine getaway situated in the eastern suburbs of South Africas administrative capital Pretoria The garden which is surrounded by urban development offers a much needed green area and corridor for wildlife in the eastern suburbs of Pretoria The ridge that runs through the garden the natural grassland and lawned areas containing beds of indigenous plants offer a habitat for many animal species,attraction
Prue Leith Restaurant,Our landscaped gardens are ideal for summer weddings and cocktail parties under the stars Indulge and treat yourself to the sublime splendor of a baby shower complimented by hand crafted chocolates cupcakes and silver cake stands,restaurant
Relish Bistro Hatfield,The Relish Bistro team is committed to provide clients with an exceptional dining experience through excellent service and unique dishes serving delicious South African cuisine prepared with passion from local produce The restaurants setting inside provides private dining and booths,restaurant
RH Hotel Pretoria,The tallest building in Pretoria the 25-storey glass and steel RH Hotel Pretoria sits atop lively Pretoria Sunnypark Shopping Centre just 2km from the heart of the city Gaze at the citys urban skyline and the mountains beyond as you cool off in our outdoor pool Relax in your modern guest room a peaceful haven with free wireless Internet away from the bustle of the city centre,accommodation
Rietvlei Nature Reserve,Rietvlei Nature Reserve belongs to the City of Tshwane and came into existence due to a water scheme to supply drinking water for the city of Pretoria Rietvlei Nature Reserve is therefore a fairly large nature reserve in an urban setting and covers about 4 000 hectares,attraction
Ritsako Guest Lodge,Nestled in the heart of the Dinokeng Game Reserve and situated 45km north of Pretoria on the N1 Highway and only 1-5 hours drive from OR Tambo International Airport lies the Ritsako Game Lodge The venue is ideal for conferencing catered and self-catering accommodation weddings functions and team building activities,accommodation
Road Lodge Centurion,The 118-room Road Lodge Centurion is conveniently located in the Centurion Gate Centre in Pretoria offering affordable and comfortable accommodation close to key business and leisure locations,accommodation
Rosemary Hill,Rosemary Hill is a working farm near Pretoria that invites visitors to reconnect with nature Emphasizing sustainable and organic farming theyve planted over 100-000 trees in 50 years fostering a vibrant ecosystem,accommodation
Royal Elephant Hotel Conference Centre,The Royal Elephant experience is shaped by a kingdom past and present by royal design and elemental grace by the symbols and smells the colours echoes and reflections of Morocco and North Africa,accommodation
Simply Asia Brooklyn Mall,At Simply Asia we are proud to offer a unique Thai dining experience with food prepared by our chefs and a menu packed full of delicious dishes to satisfy a wide range of palates And with more than 50 stores throughout the Western Cape Eastern Cape Gauteng and KwaZulu-Natal our growing presence in Botswana and Zimbabwe,restaurant
SANBI National Zoological Garden,The 85-hectare Zoo in Pretoria houses 3117 specimens of 209 mammal species 1358 specimens of 202 bird species 3871 specimens of 190 fish species 388 specimens of 4 invertebrate species 309 specimens of 93 reptile species and 44 specimens of 7 amphibian species The National Zoological Garden of South Africa is the largest zoo in the country and the only one with national status More than 600 000 people visit the Zoo annually,attraction
Siyaya Lodges,The Siyaya Group of Lodges is situated within the Pride of Africa Nature reserve within the greater Dinokeng Big 5 Game Reserve ,accommodation
Southern Sun Pretoria,Located in South Africas administrative capital our Pretoria hotel is the perfect blend of elegant design and traditional hospitality The hotel is popular among politicians diplomats- business guests and officials due to its proximity to the many embassies- consulates and government offices in the Arcadia neighbourhood,accommodation
Specialist Tours,Let Us Create Your Dream Experience From an unforgettable safari in a private game reserve to breathtaking views from the top of Table Mountain,service
Spice the Indian Kitchen,Spice-The Indian Kitchen takes pride in our great passion for Food and the Service therof We use only the freshest finest ingredients to bring you an Authentic Taste of True Indian Cuisine making us both Special and Unique,restaurant
Spout Coffee Company,Exceptional Curious Sustainable A perfect blend of exceptional coffees driven by knowledge curiosity creativity,restaurant
Square Time Cafe,Looking over the scenic surroundings of the Boardwalk lake Square Time Café is tucked under a canopy of tall green trees which have been growing as long as we have been established,restaurant
STaY Regency,At STaY Regency your satisfaction is our highest priority We are dedicated to providing an exceptional experience from the moment you step through our doors Our team attentive to every detail ensures that your stay is both comfortable and memorable From the luxurious comfort of our rooms to the exquisite dining options and personalized services we go above and beyond to meet your needs and exceed your expectations,accommodation
Sundowner Fly Fishing Adventures,We are all about eco friendly Sport and Fly Fishing Our options include a variety of destinations a short drive just outside Johannesburg in Bronkhorstpruit Magaliesburg or Cradle of Humankind much closer than you think to bucket list trips in South and Southern Africa Fishing equipment is available to hire and you can book fishing lessons with our experienced facilitators,service
Suntaluna Spa Where Body and Mind Are Revitalised,Break away from the stress and bustle of the city to the ultimate destination for relaxation and tranquillity set on the shores of the scenic Hennops River Here we offer the ideal escape where beautiful surroundings and restorative treatments work to harmonise and energise body mind and soul,spa
Supreme Travel,The company strives to understand customer needs customer expectations and the importance of customer service delivery We provide professional service to both corporate companies government departments and leisure clients,service
Thabiso Guest House,The magnificent Italian Tuscan style Thabiso Guesthouse is set on a high ridge that overlooks Meyerspark Guests are afforded the elegance privacy and comfort of a luxury modern-day establishment,accommodation
Black Bamboo Restaurant,The Black Bamboo offers a truly unique world-class dining experience which celebrates the synergy between food wine and art An ever-changing a-la-carte menu is inspired by international delicacies with a local twist and a carefully selected wine list offers interesting options for every palate and occasion,restaurant
