name,description,type
the Blades Hotel,The Blades is an exclusive hotel situated on a 10 hectare expanse of untamed bushveld built on the banks of the Roodeplaat Dam  We offer a unique combination of indigenous vegetation landscaping and water-front luxury We are conveniently situated just 20 minutes from Pretoria 40 minutes from OR Tambo International and 50 minutes from Johannesburg making it an accessible destination to both local and international guests,accommodation
the Blue Crane Restaurant Bar,The Blue Crane Restaurant and Bar situated in the heart of Pretoria next to the Austin Roberts Bird Sanctuary is now under new ownership and management Not only has the entire venue been renovated extensively but we also built a brand new Boma area ideal for functions and enjoying the bonfire on a chilly evening,restaurant
the Catwalk Lodge,A Luxury Guesthouse situated in the suburb of Erusmasrand- east of Pretoria,accommodation
the Falling Feather Inn Guest House,The Falling Feather Inn is a stylish and comfortable guest house that offers bed and breakfast in the upmarket suburb of Val-de-Grace Pretoria East South Africa  In a tranquil area next to the CSIR and close to the Botanical Gardens Val-de-Grace is an ideal location for business as well as relaxation located only 40 minutes away from OR Tambo International Airport,accommodation
the Godfather Restaurant Midstream,The Godfather has a proud tradition of exceptional food and service All beef served at The Godfather is top quality South African beef We make a special effort to procure the very best quality products for all our menu items,restaurant
the Grill Room,The Grillroom and Sushi Bar is a modern stylish restaurant which has just opened in Brooklyn Bridge Office Park in Pretoria Perfect for special occasions romantic dinners and business lunches the restaurants offers an exquisite culinary experience for all palates,restaurant
the Lions Den,The Lion s den is situated in an unique setting inside an industrial estate Our building is the 2nd oldest house in Silverton which was Built in 1896 The restaurant and venue has a quaint yet rustic atmosphere perfect for all your function needs,restaurant
the Maslow Time Square Hotel,Discover a new generation of hotels in Pretoria A trailblazing first for Sun International and South Africa The Maslow Time Square features a variety of Pretoria accommodation options all under one roof Located in the heart of the Menlyn Maine Precinct The Maslow Time Square is a premier hotel in Pretoria,accommodation
the Park Lodge Hotel Apartments,Exquisitely decorated and offset by a modern look and feel each room and apartment has been designed with the comfort of our guests in mind The Park Lodge Hotel and apartments is the last word in luxury accommodation in Pretoria,accommodation
the Ultimate Pretoria Bucket List,The ultimate pretoriabucketlist was created in 2015 to give locals and visitors to Pretoria a reliable and up to date resource of the best experiences to have during your time in the capital city Since then we have directed thousands of visitors to some of our city s most celebrated restaurants attractions and events,attraction
the Woodpecker Inn Guesthouse,The Woodpecker Inn is a luxurious five-star guest house that is hidden away on the 18th fairway of Pretoria East revered Woodhill Golfing and Residential Estate The peaceful and secure environment that The Woodpecker Inn offers combined with all the conveniences and luxuries that you would expect from a five-star guest house is why we have been the accommodation provider of choice to the travelling business executive for many years,accommodation
Thorn Tree Bush Camp,Thorn Tree Bush Camp is situated within the Dinokeng Big Five Game Reserve They have a true nature lover in mind when having you as our guest go and experience the amazing African Bushveld and its beautiful animals sunrises sunsets and nature,accommodation
Tin Roof Cafe,The heart of our business is our kitchen fitted with a traditional wood burning pizza oven and super mod‑cons Our inspiration is broiled up in this homely space Chef Pellie Grobler loves leading the dedicated team in the kitchen to ensure the product meets demand,restaurant
Toulas Greek Restaurant,We serve traditional Greek dishes as well as some Greek fusion dishes…Greek with a twist There are no main meals on our menu all dishes are mezedes The idea is to order a variety of different items place them in the centre of the table and enjoy the feast together in a more sociable way,restaurant
Travel2Africa,Travel2Africa invites you on a journey of adventure in South Africa to discover local cultures tradition savouring local cuisines listening to hummingbirds watching wildlife and gazing at landscape that tell a million stories We offer a total lucrative African Experience to international tourists wishing to embark on a journey of a lifetime and unlike most operators or travel agencies we work with fewer travellers allowing greater flexibility and a first-hand experience,service
Tshikwalo Game Lodge,Tshikwalo Game Lodge is situated within the malaria-free Dinokeng Game Reserve the first free-roaming Big-5 game reserve in Gauteng and offers an amazing African bush experience for local and international visitors Tshikwalo Game Lodge is a mere 30 minutes drive north of Pretoria and a 60 minutes drive from O R Tambo International Airport and Johannesburg,accommodation
Turn n Tender Menlyn Maine,Since 1977 Turn n Tender has served up an exceptional dining experience Here everything revolves around a love of great steak and an exceptional taste in wine Our meat is of the highest quality and provided by an exclusive central kitchen Our wines on offer are hand selected from only the best wine farms in South Africa,restaurant
Tussen I Bome Guest Farm,Tussen-I-Bome Guest Farm is a quaint ox-wagon resort and venue located 30 minutes or 26km from Montana Pretoria on the KwaMahlango-Moloto road Nestled in the malaria free Bobbejaansberg Mountains it offers an unique venue for weddings conferences functions or just a weekend break-away for the family or with friends,accommodation
Ulysses Tours Safaris,Ulysses Tours and Safaris based in Centurion - Gauteng Province - is an incoming tour operator specializing in tailor-made itineraries of tours or safaris for up-market FITs- groups - incentives and pre- and post conference tours,service
Villa San Giovanni,Italian food is less about the style of which the dish is made and more about the passion that is put into making it Who better than the nation that practically invented the term love to create such amazing dishes with something as humble as a tomato And love is but a few of the many things Italians do best,restaurant
Villa San Giovanni Hotel,Located in the main terminal building of Wonderboom National Airport our 4 Star hotel is in close proximity to Rosslyn Onderstepoort Montana Sinoville and Doornpoort with easy access to highways With us your stay is memorable,accommodation
Wing Wah Sushi,If authentic Asian cuisine is what you are craving for then our avenue in Faerie Glen is the place to go A warm welcoming atmosphere combined with Eastern hospitality,restaurant
Zilko Tours Travel,Welcome to Zilko Tours and Travel an acknowledged expert in domestic and international travel taking its clients to all points of the compass in style and comfort,service
Kream Restaurant,Founded in 2007 by Tufan Yerebakan Kream has established and developed itself into a trendy one-of-a-kind experience for many Serving delicious modern cuisine in an artistic environment Kream combines the two to provide a great sensory experience,restaurant
KAROO Grill & Bar at IRENE Village Mall,A leading steak-based restaurant It looks like a steakhouse Mmmm- it smells like a steakhouse And it certainly tastes like a steakhouse But Karoo Cattle and Land is more than just a steakhouse It is a top steak-based restaurant And a South African one at that featuring traditional SA fare like bobotie and boerewors,restaurant
